"id","name","item_no","kind","sub_kind","duration","cond","image","image_frame","effect_image","caption","created_at","name_en","name_fr","name_kr","name_scn","name_tcn","name_ina","name_thai","caption_en","caption_fr","caption_kr","caption_scn","caption_tcn","caption_ina","caption_thai"
190,"エイダ投票券",189,2,,0,,"item_z_a020.swf",1,"cutinchara01_skl00.swf","2013Unlightキャラクター人気投票の投票券。投票期間終了後はホワイトヒース3としても使える。","2010-04-06 04:53:16 UTC","Ballot for Ada","Bulletin Ada","에이다 투표권","艾妲投票券","艾妲投票券","Ada Voting Card","บัตรลงคะแนนเอด้า","Ballot for the election of the most popular character of Unlight, 2012. Can also be used as a White Heath 3 after the end of the voting period.","Bulletin de vote pour les élections du personnage le plus populaire d'Unlight, année 2013. Vous pouvez l'utiliser comme ‘Landes Brumeuses 3' après la fin de la période de vote.","2013 Unlight 캐릭터 인기 투표의 투표권. 투표 기간 종료 후는 화이트히스 3으로 사용 가능. ","2013Unlight角色人气投票的投票券。投票期间结束后投票券可当白色石楠3使用。","2013Unlight角色人氣投票的投票券。投票期間結束後投票券可當白色石楠3使用。","Kertas suara untuk pemilihan karakter terpopuler Unlight 2013.","บัตรลงคะแนนความนิยมของตัวละคร Unlight 2013 หลังจากหมดระยะเวลาลงคะแนนแล้วจะใช้แทนไวท์เฮลธ์ 3 ได้"
191,"メレン投票券",190,2,,0,,"item_z_a021.swf",1,"cutinchara01_skl00.swf","2013Unlightキャラクター人気投票の投票券。投票期間終了後はホワイトヒース3としても使える。","2010-04-06 04:53:16 UTC","Ballot for Melen","Bulletin Melen","메렌 투표권","梅伦投票券","梅倫投票券","Melen Voting Card","บัตรลงคะแนนเมเลน","Ballot for the election of the most popular character of Unlight, 2012. Can also be used as a White Heath 3 after the end of the voting period.","Bulletin de vote pour les élections du personnage le plus populaire d'Unlight, année 2013. Vous pouvez l'utiliser comme ‘Landes Brumeuses 3' après la fin de la période de vote.","2013 Unlight 캐릭터 인기 투표의 투표권. 투표 기간 종료 후는 화이트히스 3으로 사용 가능. ","2013Unlight角色人气投票的投票券。投票期间结束后投票券可当白色石楠3使用。","2013Unlight角色人氣投票的投票券。投票期間結束後投票券可當白色石楠3使用。","Kertas suara untuk pemilihan karakter terpopuler Unlight 2013.","บัตรลงคะแนนความนิยมของตัวละคร Unlight 2013 หลังจากหมดระยะเวลาลงคะแนนแล้วจะใช้แทนไวท์เฮลธ์ 3 ได้"
192,"サルガド投票券",191,2,,0,,"item_z_a022.swf",1,"cutinchara01_skl00.swf","2013Unlightキャラクター人気投票の投票券。投票期間終了後はホワイトヒース3としても使える。","2010-04-06 04:53:16 UTC","Ballot for Salgado","Bulletin Salgado","살가드 투표권","萨尔卡多投票券","薩爾卡多投票券","Salgado Voting Card","บัตรลงคะแนนซัลกาโด","Ballot for the election of the most popular character of Unlight, 2012. Can also be used as a White Heath 3 after the end of the voting period.","Bulletin de vote pour les élections du personnage le plus populaire d'Unlight, année 2013. Vous pouvez l'utiliser comme ‘Landes Brumeuses 3' après la fin de la période de vote.","2013 Unlight 캐릭터 인기 투표의 투표권. 투표 기간 종료 후는 화이트히스 3으로 사용 가능. ","2013Unlight角色人气投票的投票券。投票期间结束后投票券可当白色石楠3使用。","2013Unlight角色人氣投票的投票券。投票期間結束後投票券可當白色石楠3使用。","Kertas suara untuk pemilihan karakter terpopuler Unlight 2013.","บัตรลงคะแนนความนิยมของตัวละคร Unlight 2013 หลังจากหมดระยะเวลาลงคะแนนแล้วจะใช้แทนไวท์เฮลธ์ 3 ได้"
193,"レッドグレイヴ投票券",192,2,,0,,"item_z_a023.swf",1,"cutinchara01_skl00.swf","2013Unlightキャラクター人気投票の投票券。投票期間終了後はホワイトヒース3としても使える。","2010-04-06 04:53:16 UTC","Ballot for Redgrave","Bulletin Redgrave","레드그레이브 투표권","蕾格烈芙投票券","蕾格烈芙投票券","Redgrave Voting Card","บัตรลงคะแนนเรดเกรฟ","Ballot for the election of the most popular character of Unlight, 2012. Can also be used as a White Heath 3 after the end of the voting period.","Bulletin de vote pour les élections du personnage le plus populaire d'Unlight, année 2013. Vous pouvez l'utiliser comme ‘Landes Brumeuses 3' après la fin de la période de vote.","2013 Unlight 캐릭터 인기 투표의 투표권. 투표 기간 종료 후는 화이트히스 3으로 사용 가능. ","2013Unlight角色人气投票的投票券。投票期间结束后投票券可当白色石楠3使用。","2013Unlight角色人氣投票的投票券。投票期間結束後投票券可當白色石楠3使用。","Kertas suara untuk pemilihan karakter terpopuler Unlight 2013.","บัตรลงคะแนนความนิยมของตัวละคร Unlight 2013 หลังจากหมดระยะเวลาลงคะแนนแล้วจะใช้แทนไวท์เฮลธ์ 3 ได้"
194,"リーズ投票券",193,2,,0,,"item_z_a024.swf",1,"cutinchara01_skl00.swf","2013Unlightキャラクター人気投票の投票券。投票期間終了後はホワイトヒース3としても使える。","2010-04-06 04:53:16 UTC","Ballot for Riesz","Bulletin Riesz","리즈 투표권","里斯投票券","里斯投票券","Riesz Voting Card","บัตรลงคะแนนรีส","Ballot for the election of the most popular character of Unlight, 2012. Can also be used as a White Heath 3 after the end of the voting period.","Bulletin de vote pour les élections du personnage le plus populaire d'Unlight, année 2013. Vous pouvez l'utiliser comme ‘Landes Brumeuses 3' après la fin de la période de vote.","2013 Unlight 캐릭터 인기 투표의 투표권. 투표 기간 종료 후는 화이트히스 3으로 사용 가능. ","2013Unlight角色人气投票的投票券。投票期间结束后投票券可当白色石楠3使用。","2013Unlight角色人氣投票的投票券。投票期間結束後投票券可當白色石楠3使用。","Kertas suara untuk pemilihan karakter terpopuler Unlight 2013.","บัตรลงคะแนนความนิยมของตัวละคร Unlight 2013 หลังจากหมดระยะเวลาลงคะแนนแล้วจะใช้แทนไวท์เฮลธ์ 3 ได้"
195,"ミリアン投票券",194,2,,0,,"item_z_a025.swf",1,"cutinchara01_skl00.swf","2013Unlightキャラクター人気投票の投票券。投票期間終了後はホワイトヒース3としても使える。","2010-04-06 04:53:16 UTC","Ballot for Milian","Bulletin Milian","미리안 투표권","米利安投票券","米利安投票券","Milian Voting Card","บัตรลงคะแนนมิเลียน","Ballot for the election of the most popular character of Unlight, 2012. Can also be used as a White Heath 3 after the end of the voting period.","Bulletin de vote pour les élections du personnage le plus populaire d'Unlight, année 2013. Vous pouvez l'utiliser comme ‘Landes Brumeuses 3' après la fin de la période de vote.","2013 Unlight 캐릭터 인기 투표의 투표권. 투표 기간 종료 후는 화이트히스 3으로 사용 가능. ","2013Unlight角色人气投票的投票券。投票期间结束后投票券可当白色石楠3使用。","2013Unlight角色人氣投票的投票券。投票期間結束後投票券可當白色石楠3使用。","Kertas suara untuk pemilihan karakter terpopuler Unlight 2013.","บัตรลงคะแนนความนิยมของตัวละคร Unlight 2013 หลังจากหมดระยะเวลาลงคะแนนแล้วจะใช้แทนไวท์เฮลธ์ 3 ได้"
196,"ウォーケン投票券",195,2,,0,,"item_z_a026.swf",1,"cutinchara01_skl00.swf","2013Unlightキャラクター人気投票の投票券。投票期間終了後はホワイトヒース3としても使える。","2010-04-06 04:53:16 UTC","Ballot for Walken","Bulletin Walken","워켄 투표권","沃肯投票券","沃肯投票券","Walken Voting Card","บัตรลงคะแนนวอลเก้น","Ballot for the election of the most popular character of Unlight, 2012. Can also be used as a White Heath 3 after the end of the voting period.","Bulletin de vote pour les élections du personnage le plus populaire d'Unlight, année 2013. Vous pouvez l'utiliser comme ‘Landes Brumeuses 3' après la fin de la période de vote.","2013 Unlight 캐릭터 인기 투표의 투표권. 투표 기간 종료 후는 화이트히스 3으로 사용 가능. ","2013Unlight角色人气投票的投票券。投票期间结束后投票券可当白色石楠3使用。","2013Unlight角色人氣投票的投票券。投票期間結束後投票券可當白色石楠3使用。","Kertas suara untuk pemilihan karakter terpopuler Unlight 2013.","บัตรลงคะแนนความนิยมของตัวละคร Unlight 2013 หลังจากหมดระยะเวลาลงคะแนนแล้วจะใช้แทนไวท์เฮลธ์ 3 ได้"
197,"フロレンス投票券",196,2,,0,,"item_z_a027.swf",1,"cutinchara01_skl00.swf","2013Unlightキャラクター人気投票の投票券。投票期間終了後はホワイトヒース3としても使える。","2010-04-06 04:53:16 UTC","Ballot for Florence","Bulletin Florence","테스트 투표권","佛罗伦斯投票券","佛羅倫斯投票券","Test Voting Card","บัตรลงคะแนนฟลอเรนซ์","Ballot for the election of the most popular character of Unlight, 2012. Can also be used as a White Heath 3 after the end of the voting period.","Bulletin de vote pour les élections du personnage le plus populaire d'Unlight, année 2013. Vous pouvez l'utiliser comme ‘Landes Brumeuses 3' après la fin de la période de vote.","2013 Unlight 캐릭터 인기 투표의 투표권. 투표 기간 종료 후는 화이트히스 3으로 사용 가능. ","2013Unlight角色人气投票的投票券。投票期间结束后投票券可当白色石楠3使用。","2013Unlight角色人氣投票的投票券。投票期間結束後投票券可當白色石楠3使用。","Kertas suara untuk pemilihan karakter terpopuler Unlight 2013.","บัตรลงคะแนนความนิยมของตัวละคร Unlight 2013 หลังจากหมดระยะเวลาลงคะแนนแล้วจะใช้แทนไวท์เฮลธ์ 3 ได้"
198,"パルモ投票券",197,2,,0,,"item_z_a028.swf",1,"cutinchara01_skl00.swf","2013Unlightキャラクター人気投票の投票券。投票期間終了後はホワイトヒース3としても使える。","2010-04-06 04:53:16 UTC","Ballot for Palmo","Bulletin Palmo","파르모 투표권","帕茉投票券","帕茉投票券","Palmo Voting Card","บัตรลงคะแนนพัลโม","Ballot for the election of the most popular character of Unlight, 2012. Can also be used as a White Heath 3 after the end of the voting period.","Bulletin de vote pour les élections du personnage le plus populaire d'Unlight, année 2013. Vous pouvez l'utiliser comme ‘Landes Brumeuses 3' après la fin de la période de vote.","2013 Unlight 캐릭터 인기 투표의 투표권. 투표 기간 종료 후는 화이트히스 3으로 사용 가능. ","2013Unlight角色人气投票的投票券。投票期间结束后投票券可当白色石楠3使用。","2013Unlight角色人氣投票的投票券。投票期間結束後投票券可當白色石楠3使用。","Kertas suara untuk pemilihan karakter terpopuler Unlight 2013.","บัตรลงคะแนนความนิยมของตัวละคร Unlight 2013 หลังจากหมดระยะเวลาลงคะแนนแล้วจะใช้แทนไวท์เฮลธ์ 3 ได้"
199,"アスラ投票券",198,2,,0,,"item_z_a029.swf",1,"cutinchara01_skl00.swf","2013Unlightキャラクター人気投票の投票券。投票期間終了後はホワイトヒース3としても使える。","2010-04-06 04:53:16 UTC","Ballot for Asura","Bulletin Asura","아수라 투표권","阿修罗投票券","阿修羅投票券","Asura Voting Card","บัตรลงคะแนนอาซูร่า","Ballot for the election of the most popular character of Unlight, 2012. Can also be used as a White Heath 3 after the end of the voting period.","Bulletin de vote pour les élections du personnage le plus populaire d'Unlight, année 2013. Vous pouvez l'utiliser comme ‘Landes Brumeuses 3' après la fin de la période de vote.","2013 Unlight 캐릭터 인기 투표의 투표권. 투표 기간 종료 후는 화이트히스 3으로 사용 가능. ","2013Unlight角色人气投票的投票券。投票期间结束后投票券可当白色石楠3使用。","2013Unlight角色人氣投票的投票券。投票期間結束後投票券可當白色石楠3使用。","Kertas suara untuk pemilihan karakter terpopuler Unlight 2013.","บัตรลงคะแนนความนิยมของตัวละคร Unlight 2013 หลังจากหมดระยะเวลาลงคะแนนแล้วจะใช้แทนไวท์เฮลธ์ 3 ได้"
200,"ブロウニング投票券",199,2,,0,,"item_z_a030.swf",1,"cutinchara01_skl00.swf","2013Unlightキャラクター人気投票の投票券。投票期間終了後はホワイトヒース3としても使える。","2010-04-06 04:53:16 UTC","Ballot for Browning","Bulletin Browning","브라우닝 투표권","布朗宁投票券","布朗寧投票券","Browning Voting Card","บัตรลงคะแนนบราวนิ่ง","Ballot for the election of the most popular character of Unlight, 2012. Can also be used as a White Heath 3 after the end of the voting period.","Bulletin de vote pour les élections du personnage le plus populaire d'Unlight, année 2013. Vous pouvez l'utiliser comme ‘Landes Brumeuses 3' après la fin de la période de vote.","2013 Unlight 캐릭터 인기 투표의 투표권. 투표 기간 종료 후는 화이트히스 3으로 사용 가능. ","2013Unlight角色人气投票的投票券。投票期间结束后投票券可当白色石楠3使用。","2013Unlight角色人氣投票的投票券。投票期間結束後投票券可當白色石楠3使用。","Kertas suara untuk pemilihan karakter terpopuler Unlight 2013.","บัตรลงคะแนนความนิยมของตัวละคร Unlight 2013 หลังจากหมดระยะเวลาลงคะแนนแล้วจะใช้แทนไวท์เฮลธ์ 3 ได้"
201,"マルセウス投票券",200,2,,0,,"item_z_a031.swf",1,"cutinchara01_skl00.swf","2013Unlightキャラクター人気投票の投票券。投票期間終了後はホワイトヒース3としても使える。","2010-04-06 04:53:16 UTC","Ballot for Marseus","Bulletin Marseus","마르세우스 투표권","玛尔瑟斯投票券","瑪爾瑟斯投票券","Maruseus Voting Card","บัตรลงคะแนนมาร์เซอุส","Ballot for the election of the most popular character of Unlight, 2012. Can also be used as a White Heath 3 after the end of the voting period.","Bulletin de vote pour les élections du personnage le plus populaire d'Unlight, année 2013. Vous pouvez l'utiliser comme ‘Landes Brumeuses 3' après la fin de la période de vote.","2013 Unlight 캐릭터 인기 투표의 투표권. 투표 기간 종료 후는 화이트히스 3으로 사용 가능. ","2013Unlight角色人气投票的投票券。投票期间结束后投票券可当白色石楠3使用。","2013Unlight角色人氣投票的投票券。投票期間結束後投票券可當白色石楠3使用。","Kertas suara untuk pemilihan karakter terpopuler Unlight 2013.","บัตรลงคะแนนความนิยมของตัวละคร Unlight 2013 หลังจากหมดระยะเวลาลงคะแนนแล้วจะใช้แทนไวท์เฮลธ์ 3 ได้"
202,"ルート投票券",201,2,,0,,"item_z_a032.swf",1,"cutinchara01_skl00.swf","2013Unlightキャラクター人気投票の投票券。投票期間終了後はホワイトヒース3としても使える。","2010-04-06 04:53:16 UTC","Ballot for Rood","Bulletin Rood","루드 투표권","路德投票券","路德投票券","Rood Voting Card","บัตรลงคะแนนรูท","Ballot for the election of the most popular character of Unlight, 2012. Can also be used as a White Heath 3 after the end of the voting period.","Bulletin de vote pour les élections du personnage le plus populaire d'Unlight, année 2013. Vous pouvez l'utiliser comme ‘Landes Brumeuses 3' après la fin de la période de vote.","2013 Unlight 캐릭터 인기 투표의 투표권. 투표 기간 종료 후는 화이트히스 3으로 사용 가능. ","2013Unlight角色人气投票的投票券。投票期间结束后投票券可当白色石楠3使用。","2013Unlight角色人氣投票的投票券。投票期間結束後投票券可當白色石楠3使用。","Kertas suara untuk pemilihan karakter terpopuler Unlight 2013.","บัตรลงคะแนนความนิยมของตัวละคร Unlight 2013 หลังจากหมดระยะเวลาลงคะแนนแล้วจะใช้แทนไวท์เฮลธ์ 3 ได้"
203,"リュカ投票券",202,2,,0,,"item_z_a033.swf",1,"cutinchara01_skl00.swf","2013Unlightキャラクター人気投票の投票券。投票期間終了後はホワイトヒース3としても使える。","2010-04-06 04:53:16 UTC","Ballot for Luka","Bulletin Luka","루카 투표권","鲁卡投票券","魯卡投票券","Luka Voting Card","บัตรลงคะแนนลูคา","Ballot for the election of the most popular character of Unlight, 2012. Can also be used as a White Heath 3 after the end of the voting period.","Bulletin de vote pour les élections du personnage le plus populaire d'Unlight, année 2013. Vous pouvez l'utiliser comme ‘Landes Brumeuses 3' après la fin de la période de vote.","2013 Unlight 캐릭터 인기 투표의 투표권. 투표 기간 종료 후는 화이트히스 3으로 사용 가능. ","2013Unlight角色人气投票的投票券。投票期间结束后投票券可当白色石楠3使用。","2013Unlight角色人氣投票的投票券。投票期間結束後投票券可當白色石楠3使用。","Kertas suara untuk pemilihan karakter terpopuler Unlight 2013.","บัตรลงคะแนนความนิยมของตัวละคร Unlight 2013 หลังจากหมดระยะเวลาลงคะแนนแล้วจะใช้แทนไวท์เฮลธ์ 3 ได้"
204,"ステイシア投票券",203,2,,0,,"item_z_a034.swf",1,"cutinchara01_skl00.swf","2013Unlightキャラクター人気投票の投票券。投票期間終了後はホワイトヒース3としても使える。","2010-04-06 04:53:16 UTC","Ballot for Stacia","Bulletin Stacia","스테이시아 투표권","史塔夏投票券","史塔夏投票券","Stacia Voting Card","บัตรลงคะแนนสเตเชีย","Ballot for the election of the most popular character of Unlight, 2012. Can also be used as a White Heath 3 after the end of the voting period.","Bulletin de vote pour les élections du personnage le plus populaire d'Unlight, année 2013. Vous pouvez l'utiliser comme ‘Landes Brumeuses 3' après la fin de la période de vote.","2013 Unlight 캐릭터 인기 투표의 투표권. 투표 기간 종료 후는 화이트히스 3으로 사용 가능. ","2013Unlight角色人气投票的投票券。投票期间结束后投票券可当白色石楠3使用。","2013Unlight角色人氣投票的投票券。投票期間結束後投票券可當白色石楠3使用。","Kertas suara untuk pemilihan karakter terpopuler Unlight 2013.","บัตรลงคะแนนความนิยมของตัวละคร Unlight 2013 หลังจากหมดระยะเวลาลงคะแนนแล้วจะใช้แทนไวท์เฮลธ์ 3 ได้"
205,"ヴォランド投票券",204,2,,0,,"item_z_a035.swf",1,"cutinchara01_skl00.swf","2013Unlightキャラクター人気投票の投票券。投票期間終了後はホワイトヒース3としても使える。","2010-04-06 04:53:16 UTC","Ballot for Vorand","Bulletin Vorand","볼랜드 투표권","沃兰德投票券","沃蘭德投票券","Vorand Voting Card","บัตรลงคะแนนโวรันด์","Ballot for the election of the most popular character of Unlight, 2012. Can also be used as a White Heath 3 after the end of the voting period.","Bulletin de vote pour les élections du personnage le plus populaire d'Unlight, année 2013. Vous pouvez l'utiliser comme ‘Landes Brumeuses 3' après la fin de la période de vote.","2013 Unlight 캐릭터 인기 투표의 투표권. 투표 기간 종료 후는 화이트히스 3으로 사용 가능. ","2013Unlight角色人气投票的投票券。投票期间结束后投票券可当白色石楠3使用。","2013Unlight角色人氣投票的投票券。投票期間結束後投票券可當白色石楠3使用。","Kertas suara untuk pemilihan karakter terpopuler Unlight 2013.","บัตรลงคะแนนความนิยมของตัวละคร Unlight 2013 หลังจากหมดระยะเวลาลงคะแนนแล้วจะใช้แทนไวท์เฮลธ์ 3 ได้"
206,"C.C.投票券",205,2,,0,,"item_z_a036.swf",1,"cutinchara01_skl00.swf","2013Unlightキャラクター人気投票の投票券。投票期間終了後はホワイトヒース3としても使える。","2010-04-06 04:53:16 UTC","Ballot for C.C.","Bulletin C.C","C.C. 투표권","C.C.投票券","C.C.投票券","C.C. Voting Card","บัตรลงคะแนน C.C.","Ballot for the election of the most popular character of Unlight, 2012. Can also be used as a White Heath 3 after the end of the voting period.","Bulletin de vote pour les élections du personnage le plus populaire d'Unlight, année 2013. Vous pouvez l'utiliser comme ‘Landes Brumeuses 3' après la fin de la période de vote.","2013 Unlight 캐릭터 인기 투표의 투표권. 투표 기간 종료 후는 화이트히스 3으로 사용 가능. ","2013Unlight角色人气投票的投票券。投票期间结束后投票券可当白色石楠3使用。","2013Unlight角色人氣投票的投票券。投票期間結束後投票券可當白色石楠3使用。","Kertas suara untuk pemilihan karakter terpopuler Unlight 2013.","บัตรลงคะแนนความนิยมของตัวละคร Unlight 2013 หลังจากหมดระยะเวลาลงคะแนนแล้วจะใช้แทนไวท์เฮลธ์ 3 ได้"
207,"コッブ投票券",206,2,,0,,"item_z_a037.swf",1,"cutinchara01_skl00.swf","2013Unlightキャラクター人気投票の投票券。投票期間終了後はホワイトヒース3としても使える。","2010-04-06 04:53:16 UTC","Ballot for Cobb","Bulletin Cobb","콥 투표권","柯布投票券","柯布投票券","Cobb Voting Card","บัตรลงคะแนนค็อบบ์","Ballot for the election of the most popular character of Unlight, 2012. Can also be used as a White Heath 3 after the end of the voting period.","Bulletin de vote pour les élections du personnage le plus populaire d'Unlight, année 2013. Vous pouvez l'utiliser comme ‘Landes Brumeuses 3' après la fin de la période de vote.","2013 Unlight 캐릭터 인기 투표의 투표권. 투표 기간 종료 후는 화이트히스 3으로 사용 가능. ","2013Unlight角色人气投票的投票券。投票期间结束后投票券可当白色石楠3使用。","2013Unlight角色人氣投票的投票券。投票期間結束後投票券可當白色石楠3使用。","Kertas suara untuk pemilihan karakter terpopuler Unlight 2013.","บัตรลงคะแนนความนิยมของตัวละคร Unlight 2013 หลังจากหมดระยะเวลาลงคะแนนแล้วจะใช้แทนไวท์เฮลธ์ 3 ได้"
