"id","name","item_no","kind","sub_kind","duration","cond","image","image_frame","effect_image","caption","created_at","name_en","name_fr","name_kr","name_scn","name_tcn","name_ina","name_thai","caption_en","caption_fr","caption_kr","caption_scn","caption_tcn","caption_ina","caption_thai"
364,"ペンデュラム改 4",363,4,,0,,"item_c_c560.swf",4,"cutinchara01_skl00.swf","開催中のイベントに応じた渦を発見します。現在発見する渦：魔を呼ぶ鐘の音イベント",,"Pendant EX 4","Pendulum Révisé 4",,"摆坠改4","擺墜改4",,,"Discovers a vortex in a RAID when used. Discovered Vortex: Approaching the Monolith.","Vous découvrez le Vortex associé au Raid Event en cours. Vortex à découvrir : Roc en approche",,"使用後将发现RAID活动的涡。目前可找到的涡：唤魔的钟声","使用後將發現RAID活動的渦。目前可找到的渦：喚魔的鐘聲",,
365,"ペンデュラム改 5",364,4,,0,,"item_c_c560.swf",5,"cutinchara01_skl00.swf","開催中のイベントに応じた渦を発見します。現在発見する渦：",,"Pendant EX 5","Pendulum Révisé 5",,"摆坠改5","擺墜改5",,,"Discovers a vortex in a RAID when used. Discovered Vortex:","Vous découvrez le Vortex associé au Raid Event en cours. Vortex à découvrir :",,"使用後将发现RAID活动中的涡。现在发现的涡：","使用後將發現RAID活動中的渦。現在發現的渦：",,
366,"β型渦探知機 I",365,4,,0,,"item_c_c501.swf",1,"cutinchara01_skl00.swf","レイドで使用すると渦を発見します。毎月最終週の定期メンテナンス時に消失します。",,"β Vortex Detector I","Détecteur de Vortex de type β I",,"β型涡探知机 I","β型渦探知機 I",,,"Discovers a vortex when used in a RAID. (Disappears after the conclusion of the event)","Lorsque vous l'utilisez lors d'un Raid, vous découvrez un Vortex (disparaît lorsque l'événement prend fin)",,"在RAID中使用後可发现涡。此道具将在每个月的最後一次定期维护时消失。","在RAID中使用後可發現渦。此道具將在每個月的最後一次定期維護時消失。",,
367,"β型渦探知機 II",366,4,,0,,"item_c_c501.swf",2,"cutinchara01_skl00.swf","レイドで使用すると渦を発見します。毎月最終週の定期メンテナンス時に消失します。",,"β Vortex Detector II","Détecteur de Vortex de type β II",,"β型涡探知机 II","β型渦探知機 II",,,"Discovers a vortex when used in a RAID. (Disappears after the conclusion of the event)","Lorsque vous l'utilisez lors d'un Raid, vous découvrez un Vortex (disparaît lorsque l'événement prend fin)",,"在RAID中使用後可发现涡。此道具将在每个月的最後一次定期维护时消失。","在RAID中使用後可發現渦。此道具將在每個月的最後一次定期維護時消失。",,
368,"β型渦探知機 III",367,4,,0,,"item_c_c501.swf",3,"cutinchara01_skl00.swf","レイドで使用すると渦を発見します。",,"β Vortex Detector III","Détecteur de Vortex de type β III",,"β型涡探知机 III","β型渦探知機 III ",,,"Discovers a vortex when used in a RAID.","Lorsque vous l'utilisez lors d'un Raid, vous découvrez un Vortex",,"在RAID中使用後可发现涡。","在RAID中使用後可發現渦。",,
369,"β型渦探知機 IV",368,4,,0,,"item_c_c501.swf",4,"cutinchara01_skl00.swf","レイドで使用すると渦を発見します。",,"β Vortex Detector IV","Détecteur de Vortex de type β IV",,"β型涡探知机 IV","β型渦探知機 IV",,,"Discovers a vortex when used in a RAID.","Lorsque vous l'utilisez lors d'un Raid, vous découvrez un Vortex",,"在RAID中使用後可发现涡。","在RAID中使用後可發現渦。",,
370,"β型渦探知機 V",369,4,,0,,"item_c_c501.swf",5,"cutinchara01_skl00.swf","レイドで使用すると渦を発見します。",,"β Vortex Detector V","Détecteur de Vortex de type β V",,"β型涡探知机 V","β型渦探知機 V",,,"Discovers a vortex when used in a RAID.","Lorsque vous l'utilisez lors d'un Raid, vous découvrez un Vortex",,"在RAID中使用後可发现涡。","在RAID中使用後可發現渦。",,
371,"かえるの置物",370,3,,0,,"item_c_e039.swf",1,"cutinchara01_skl00.swf","「懶惰と憤怒」イベント用収集アイテム(イベント終了後に消失します)",,"Frog Decoration","Ornement grenouille",,"青蛙的摆饰","青蛙的擺飾",,,"Collectible in the event <Laziness and Fury> (deleted after the event)","Item à collectionner durant l'événement <Fainéantise et Colère> (disparaît lorsque l'événement prend fin).",,"“懒惰与愤怒”活动的收集道具。(活动结束後消失)","「懶惰與憤怒」活動的收集道具。(活動結束後消失)",,
372,"バンテージ",371,3,,0,,"item_c_e040.swf",1,"cutinchara01_skl00.swf","「懶惰と憤怒」イベント用収集アイテム(イベント終了後に消失します)",,"Bandage","Sparadrap",,"绷带","繃帶",,,"Collectible in the event <Laziness and Fury> (deleted after the event)","Item à collectionner durant l'événement <Fainéantise et Colère> (disparaît lorsque l'événement prend fin).",,"“懒惰与愤怒”活动的收集道具。(活动结束後消失)","「懶惰與憤怒」活動的收集道具。(活動結束後消失)",,
373,"パンプキンクッキー（緑）",372,3,,0,,"item_c_e041.swf",1,"cutinchara01_skl00.swf","「死霊の森」イベント用収集アイテム(イベント終了後に消失します)",,"Pumpkin Cookie (Green)","Biscuit de Halloween (vert)",,"南瓜饼乾(绿)","南瓜餅乾(綠)",,,"Collectible in the event <Specter of Forest> (deleted after the event)","Item à collectionner durant l'événement <Spectre de la Forêt> (disparaît lorsque l'événement prend fin).",,"“死灵之森”活动用收集道具(活动结束後消失)","「死靈之森」活動用收集道具(活動結束後消失)",,
374,"パンプキンクッキー（橙）",373,3,,0,,"item_c_e041.swf",2,"cutinchara01_skl00.swf","「死霊の森」イベント用収集アイテム(イベント終了後に消失します)",,"Pumpkin Cookie (Orange)","Biscuit de Halloween (orange)",,"南瓜饼乾(橘)","南瓜餅乾(橘)",,,"Collectible in the event <Specter of Forest> (deleted after the event)","Item à collectionner durant l'événement <Spectre de la Forêt> (disparaît lorsque l'événement prend fin).",,"“死灵之森”活动用收集道具(活动结束後消失)","「死靈之森」活動用收集道具(活動結束後消失)",,
375,"パンプキンクッキー（白）",374,3,,0,,"item_c_e041.swf",3,"cutinchara01_skl00.swf","「死霊の森」イベント用収集アイテム(イベント終了後に消失します)",,"Pumpkin Cookie (White)","Biscuit de Halloween (blanc)",,"南瓜饼乾(白)","南瓜餅乾(白)",,,"Collectible in the event <Specter of Forest> (deleted after the event)","Item à collectionner durant l'événement <Spectre de la Forêt> (disparaît lorsque l'événement prend fin).",,"“死灵之森”活动用收集道具(活动结束後消失)","「死靈之森」活動用收集道具(活動結束後消失)",,
376,"妖魔のコンパス（緑）",375,1,,0,,"item_c_b008.swf",2,"cutinchara01_skl00.swf","進行度を達成している場合、イベント地域のボスクエストを取得します。進行中の地域が無い場合、ランダムでイベント地域のボスクエストを取得します。","2010-04-06 04:53:16 UTC","Demon's Compass (Green)","Compas du Diable","요마의 나침반","妖魔的指南針(綠)","妖魔的指南針(綠)","Demon Compass","เข็มทิศภูต","If you achieve the required progression level, this area's boss quest will appear. If there is no progressing area, random boss quest will appear.","If you achieve the required progression level, this area's boss quest will appear. If there is no progressing area, random boss quest will appear.","해당 지역의 달성도가 최대치일때 보스 퀘스트를 획득할 수 있습니다. (퀘스트 전용)","在任务进行度达成满值的情况下使用，将会找到所在地区的Boss任務。","在活動任務進行度達成滿值的情況下，將可取得所在地區的Boss任務。若無進行中地區的情況下，將會隨機取得活動地區的Boss任務。","Memunculkan Boss setelah Quest selanjutnya diselesaikan.","หากอัตราความก้าวหน้าถึงปริมาณที่กำหนดแล้ว บอสเควสของอาณาเขตนั้นจะปรากฎออกมา"
377,"エネルギーチューブ",376,3,,0,,"item_c_e042.swf",1,"cutinchara01_skl00.swf","「鋼鉄の守護者」イベント用収集アイテム(イベント終了後に消失します)",,"Energy Tube","Tube d'énergie",,"能量软管","能量軟管",,,"Collectible in the event <Fullmetal Guardian> (deleted after the event)","Item à collectionner durant l'événement <Gardien d'Acier> (disparaît lorsque l'événement prend fin).",,"“钢铁的守护者”活动用收集道具(活动结束後消失)","「鋼鐵的守護者」活動用收集道具(活動結束後消失)",,
378,"シリンダー",377,3,,0,,"item_c_e043.swf",1,"cutinchara01_skl00.swf","「鋼鉄の守護者」イベント用収集アイテム(イベント終了後に消失します)",,"Cylinder","Cylindre",,"气缸","氣缸",,,"Collectible in the event <Fullmetal Guardian> (deleted after the event)","Item à collectionner durant l'événement <Gardien d'Acier> (disparaît lorsque l'événement prend fin).",,"“钢铁的守护者”活动用收集道具(活动结束後消失)","「鋼鐵的守護者」活動用收集道具(活動結束後消失)",,
379,"プレゼントボックス",378,1,,0,,"item_c_e044.swf",1,"cutinchara01_skl00.swf","クエストで使用すると双角の魔物イベント用クエストを取得します(イベント終了後に消失します)","2010-04-06 04:53:16 UTC","Gift Box","Boîte à Cadeau",,"礼物箱","禮物盒",,,"Use at the quest area to trigger the Two Horn Monster quest (deleted after the event)","Lorsque vous l'utilisez lors d'une Quête, vous obtenez une Quête de l'Événement <Démon Cornu> (disparaît lorsque l'événement prend fin).",,"在任务区使用就可以得到双角的魔物活动任务。(活动结束後消失)","在任務區使用就可以得到雙角的魔物活動任務。(活動結束後消失)",,
380,"キャンディケイン",379,3,,0,,"item_c_e045.swf",1,"cutinchara01_skl00.swf","双角の魔物イベント用収集アイテム(イベント終了後に消失します)","2010-04-06 04:53:16 UTC","Candy Cane","Sucre d'Orge",0,"拐杖糖","拐杖糖",,,"Collectible in the Two Horn Monster event (deleted after the event)","Item à collectionner durant l'événement <Démon Cornu> (disparaît lorsque l'événement prend fin).",,"双角的魔物活动用收集道具。(活动结束後消失)","雙角的魔物活動用收集道具。(活動結束後消失)",,
381,"ビクトリーコイン",380,3,,0,,"item_z_c000.swf",1,"cutinchara01_skl00.swf","2015年人気投票で優勝したキャラクターの新リザルト画面選択アイテムを取得できます（新リザルト画面選択アイテム実装時に消失します）",,"Victory Coin","Pièce de la Victoire",,"胜利硬币","勝利硬幣",,,"Use to get the diagram of the most popular character of Unlight for 2015 (deleted after you select a new diagram)","Vous pouvez obtenir un accessoire se trouvant sur la page annonçant les nouveaux résultats du concours de popularité de l'année 2015 (la page s'effacera une fois votre choix fait).",,"可取得2015年人气投票优胜角色结算图(选择新结算画面後消失)","可取得2015年人氣投票優勝角色結算圖(選擇新結算畫面後消失)",,
382,"ドーナツケース",381,1,,0,,"item_c_e046.swf",1,"cutinchara01_skl00.swf","クエストで使用すると「導都の機械蝶」イベントを取得します(イベント終了後に消失します)",,"Donut Box","Boîte à donuts",,"甜甜圈盒","甜甜圈盒",,,"Use this item during a quest to obtain the event quest <Pandemonium's Mech Butterflies>. (deleted after the event)","Lorsque vous l'utilisez lors de la Quête, vous obtenez l'Événement <Papillons mécaniques de la Capitale> (disparaît lorsque l'événement prend fin).",,"使用後可取得“导都的机械蝶”活动专属任务。(活动结束後消失)","使用後可取得「導都的機械蝶」活動專屬任務。(活動結束後消失)",,
383,"白い機械蝶",382,3,,0,,"item_c_e047.swf",1,"cutinchara01_skl00.swf","「導都の機械蝶」イベント用収集アイテム(イベント終了後に消失します)",,"White Mech Butterfly","Papillons mécaniques blancs",,"白色机械蝶","白色機械蝶",,,"Collectible in the event <Pandemonium's Mech Butterflies> (deleted after the event)","Item propre à l'Événement <Papillons mécaniques de la Capitale> (disparaît lorsque l'événement prend fin).",,"“导都的机械蝶”收集道具(活动结束後消失)","「導都的機械蝶」收集道具(活動結束後消失)",,
384,"カカオ",383,3,,0,,"item_c_e048.swf",1,"cutinchara01_skl00.swf","「にじり寄る巨岩」イベント用収集アイテム(イベント終了後に消失します)",,"Cocoa Fruit","Fève de Cacao",,"可可果","可可果",,,"Collectible for [Approaching the Monolith] (deleted after the event)","Item propre à l'Événement <Roc en approche> (disparaît lorsque l'événement prend fin).",,"“逐渐逼近的巨岩”收集道具(活动结束後消失)","「逐漸逼近的巨岩」收集道具(活動結束後消失)",,
385,"完熟カカオ",384,3,,0,,"item_c_e048.swf",2,"cutinchara01_skl00.swf","「にじり寄る巨岩」イベント用収集アイテム(イベント終了後に消失します)",,"Ripe Cocoa Fruit","Fève de Cacao mûre",,"成熟可可果","成熟可可果",,,"Collectible for [Approaching the Monolith] (deleted after the event)","Item propre à l'Événement <Roc en approche> (disparaît lorsque l'événement prend fin).",,"“逐渐逼近的巨岩”收集道具(活动结束後消失)","「逐漸逼近的巨岩」收集道具(活動結束後消失)",,
386,"ホワイトカード",385,3,,0,,"item_c_e050.swf",1,"cutinchara01_skl00.swf","「白い贈り物」イベント用収集アイテム(イベント終了後に消失します)",,"White Cards","Carte Blanche",,"白色卡片","白色卡片",,,"Collectibles for the [White Rewards] (Not available after event ends)","Item propre à l'Événement <Cadeau Blanc> (disparaît lorsque l'événement prend fin).",,"“白色赠礼”收集道具(活动结束後消失)","「白色贈禮」收集道具(活動結束後消失)",,
387,"青いプレゼントボックス",386,1,,0,,"item_c_e051.swf",1,"cutinchara01_skl00.swf","クエストで使用すると「白い贈り物」イベント用クエストを取得します(イベント終了後に消失します)",,"Blue Gift Box","Boîte à Cadeau Bleue",,"蓝色礼物箱","藍色禮物箱",,,"When used in the mission area, players may receive the [White Reward] missions. (deleted after the event)","Vous obtenez l'Événement <Cadeau Blanc> lorsque vous l'utilisez lors d'une Quête (disparaît lorsque l'événement prend fin).",,"在任务区使用後,就可以得到“白色情人节”的任务。(活动结束後消失)","在任務區使用後,就可以得到「白色贈禮」的任務。(活動結束後消失)",,
388,"赤涙の仮面",387,3,,0,,"item_c_e060.swf",1,"cutinchara01_skl00.swf","「鏡合わせの冥闇」イベント用収集アイテム(イベント終了後に消失します)",,,"Masque aux Larmes Rouges",,"红泪的面具","紅淚的面具",,,,"Item propre à l'Événement <Reflet Obscur> (disparaît lorsque l'événement prend fin).",,"“冥闇之镜影”收集道具(活动结束後消失)","「冥闇之鏡影」收集道具(活動結束後消失)",,
389,"緑涙の仮面",388,3,,0,,"item_c_e060.swf",2,"cutinchara01_skl00.swf","「鏡合わせの冥闇」イベント用収集アイテム(イベント終了後に消失します)",,,"Masque aux Larmes Vertes",,"绿泪的面具","綠淚的面具",,,,"Item propre à l'Événement <Reflet Obscur> (disparaît lorsque l'événement prend fin).",,"“冥闇之镜影”收集道具(活动结束後消失)","「冥闇之鏡影」收集道具(活動結束後消失)",,
390,"黄涙の仮面",389,3,,0,,"item_c_e060.swf",3,"cutinchara01_skl00.swf","「鏡合わせの冥闇」イベント用収集アイテム(イベント終了後に消失します)",,,"Masque aux Larmes Dorées",,"黄泪的面具","黃淚的面具",,,,"Item propre à l'Événement <Reflet Obscur> (disparaît lorsque l'événement prend fin).",,"“冥闇之镜影”收集道具(活动结束後消失)","「冥闇之鏡影」收集道具(活動結束後消失)",,
391,"黒の招待状",390,1,,0,,"item_c_e061.swf",1,"cutinchara01_skl00.swf","クエストで使用すると「歪みの断罪者」イベント用クエストを取得します(イベント終了後に消失します)",,,,,"黑色招待卷","黑色招待卷",,,,,,"在任务区使用後,就可以得到“歪曲的制裁者”的任务。(活动结束後消失)","在任務區使用後,就可以得到「歪曲的制裁者」的任務。(活動結束後消失)",,
392,"勝者のティーカップ",391,3,,0,,"item_c_e062.swf",1,"cutinchara01_skl00.swf","「歪みの断罪者」イベント用収集アイテム(イベント終了後に消失します)",,,,,"胜者茶杯","勝者茶杯",,,,,,"“歪曲的制裁者”收集道具(活动结束後消失)","「歪曲的制裁者」收集道具(活動結束後消失)",,
393,"ちまき",392,3,,0,,"item_c_e063.swf",2,"cutinchara01_skl00.swf","「飢えた悪龍」イベント用収集アイテム(イベント終了後に消失します)",,,,,"粽子","粽子",,,,,," “饥饿的恶龙”收集道具(活动结束後消失)","「飢餓的惡龍」收集道具(活動結束後消失)",,
394,"硝子玉（赤)",393,3,,0,,"item_c_e064.swf",1,"cutinchara01_skl00.swf","「幽玄の艶衣」イベント用収集アイテム(イベント終了後に消失します)",,,,,"玻璃珠(红)","玻璃珠(紅)",,,,,,"“幽玄的艳衣”活动收集道具(活动结束后消失)","「幽玄的豔衣」活動收集道具(活動結束後消失)",,
395,"硝子玉（黒)",394,3,,0,,"item_c_e064.swf",2,"cutinchara01_skl00.swf","「幽玄の艶衣」イベント用収集アイテム(イベント終了後に消失します)",,,,,"玻璃珠(黑)","玻璃珠(黑)",,,,,,"“幽玄的艳衣”活动收集道具(活动结束后消失)","「幽玄的豔衣」活動收集道具(活動結束後消失)",,
396,"硝子玉（金)",395,3,,0,,"item_c_e064.swf",3,"cutinchara01_skl00.swf","「幽玄の艶衣」イベント用収集アイテム(イベント終了後に消失します)",,,,,"玻璃珠(金)","玻璃珠(金)",,,,,,"“幽玄的艳衣”活动收集道具(活动结束后消失)","「幽玄的豔衣」活動收集道具(活動結束後消失)",,
397,"アルファタグ",396,3,,0,,"item_c_e065.swf",1,"cutinchara01_skl00.swf","「偽りの首級」イベント用収集アイテム(イベント終了後に消失します)",,,,,"α军牌","α軍牌",,,,,,"“虚假的首级”活动收集道具(活动结束后消失)","「虛假的首級」活動收集道具(活動結束後消失)",,
398,"ベータタグ",397,3,,0,,"item_c_e065.swf",2,"cutinchara01_skl00.swf","「偽りの首級」イベント用収集アイテム(イベント終了後に消失します)",,,,,"β军牌","β軍牌",,,,,,"“虚假的首级”活动收集道具(活动结束后消失)","「虛假的首級」活動收集道具(活動結束後消失)",,
399,"ガンマタグ",398,3,,0,,"item_c_e065.swf",3,"cutinchara01_skl00.swf","「偽りの首級」イベント用収集アイテム(イベント終了後に消失します)",,,,,"γ军牌","γ軍牌",,,,,,"“虚假的首级”活动收集道具(活动结束后消失)","「虛假的首級」活動收集道具(活動結束後消失)",,
400,"月長石",399,3,,0,,"item_c_e066.swf",1,"cutinchara01_skl00.swf","「万斛の魔物」イベント用収集アイテム(イベント終了後に消失します)",,,,,"月长石","月長石",,,,,,"“万斛魔物”活动收集道具(活动结束后消失)","「萬斛魔物」活動收集道具(活動結束後消失)",,
401,"黒いボルト",400,3,,0,,"item_c_e067.swf",1,"cutinchara01_skl00.swf","「彼方からの侵略」イベント用収集アイテム(イベント終了後に消失します)",,,,,"黑色螺丝","黑色螺絲",,,,,,"“来自远方的侵略”活动收集道具(活动结束后消失)","「來自遠方的侵略」活動收集道具(活動結束後消失)",,
402,"エヴァリスト投票券",401,2,,0,,"item_z_d001.swf",1,"cutinchara01_skl00.swf","2016Unlightキャラクター人気投票の投票券。投票期間終了後はホワイトヒース3としても使える。",,"Ballot for Evarist","Bulletin Evarist",,"艾伯李斯特投票券","艾伯李斯特投票券",,,"Ballot for the election of the most popular character of Unlight, 2014After the election period, a ballot can be used as a White Health 3.","Bulletin de vote pour les élections du personnage le plus populaire d'Unlight, année 2014. Vous pouvez l'utiliser comme ‘Landes Brumeuses 3' après la fin de la période de vote.",,"2016Unlight角色人气投票的投票券。投票期间结束后投票券可当白色石楠3使用。","2016Unlight角色人氣投票的投票券。投票期間結束後投票券可當白色石楠3使用。",,
403,"アイザック投票券",402,2,,0,,"item_z_d002.swf",1,"cutinchara01_skl00.swf","2016Unlightキャラクター人気投票の投票券。投票期間終了後はホワイトヒース3としても使える。",,"Ballot for Izac","Bulletin Isaac",,"艾依查库投票券","艾依查庫投票券",,,"Ballot for the election of the most popular character of Unlight, 2014After the election period, a ballot can be used as a White Health 3.","Bulletin de vote pour les élections du personnage le plus populaire d'Unlight, année 2014. Vous pouvez l'utiliser comme ‘Landes Brumeuses 3' après la fin de la période de vote.",,"2016Unlight角色人气投票的投票券。投票期间结束后投票券可当白色石楠3使用。","2016Unlight角色人氣投票的投票券。投票期間結束後投票券可當白色石楠3使用。",,
404,"グリュンワルド投票券",403,2,,0,,"item_z_d003.swf",1,"cutinchara01_skl00.swf","2016Unlightキャラクター人気投票の投票券。投票期間終了後はホワイトヒース3としても使える。",,"Ballot for Grunwald","Bulletin Grunwald",,"古鲁瓦尔多投票券","古魯瓦爾多投票券",,,"Ballot for the election of the most popular character of Unlight, 2014After the election period, a ballot can be used as a White Health 3.","Bulletin de vote pour les élections du personnage le plus populaire d'Unlight, année 2014. Vous pouvez l'utiliser comme ‘Landes Brumeuses 3' après la fin de la période de vote.",,"2016Unlight角色人气投票的投票券。投票期间结束后投票券可当白色石楠3使用。","2016Unlight角色人氣投票的投票券。投票期間結束後投票券可當白色石楠3使用。",,
405,"アベル投票券",404,2,,0,,"item_z_d004.swf",1,"cutinchara01_skl00.swf","2016Unlightキャラクター人気投票の投票券。投票期間終了後はホワイトヒース3としても使える。",,"Ballot for Abel","Bulletin Abel",,"阿贝尔投票券","阿貝爾投票券",,,"Ballot for the election of the most popular character of Unlight, 2014After the election period, a ballot can be used as a White Health 3.","Bulletin de vote pour les élections du personnage le plus populaire d'Unlight, année 2014. Vous pouvez l'utiliser comme ‘Landes Brumeuses 3' après la fin de la période de vote.",,"2016Unlight角色人气投票的投票券。投票期间结束后投票券可当白色石楠3使用。","2016Unlight角色人氣投票的投票券。投票期間結束後投票券可當白色石楠3使用。",,
406,"レオン投票券",405,2,,0,,"item_z_d005.swf",1,"cutinchara01_skl00.swf","2016Unlightキャラクター人気投票の投票券。投票期間終了後はホワイトヒース3としても使える。",,"Ballot for Leon","Bulletin Leon",,"利恩投票券","利恩投票券",,,"Ballot for the election of the most popular character of Unlight, 2014After the election period, a ballot can be used as a White Health 3.","Bulletin de vote pour les élections du personnage le plus populaire d'Unlight, année 2014. Vous pouvez l'utiliser comme ‘Landes Brumeuses 3' après la fin de la période de vote.",,"2016Unlight角色人气投票的投票券。投票期间结束后投票券可当白色石楠3使用。","2016Unlight角色人氣投票的投票券。投票期間結束後投票券可當白色石楠3使用。",,
407,"クレーニヒ投票券",406,2,,0,,"item_z_d006.swf",1,"cutinchara01_skl00.swf","2016Unlightキャラクター人気投票の投票券。投票期間終了後はホワイトヒース3としても使える。",,"Ballot for Kronig","Bulletin Kronig",,"库勒尼西投票券","庫勒尼西投票券",,,"Ballot for the election of the most popular character of Unlight, 2014After the election period, a ballot can be used as a White Health 3.","Bulletin de vote pour les élections du personnage le plus populaire d'Unlight, année 2014. Vous pouvez l'utiliser comme ‘Landes Brumeuses 3' après la fin de la période de vote.",,"2016Unlight角色人气投票的投票券。投票期间结束后投票券可当白色石楠3使用。","2016Unlight角色人氣投票的投票券。投票期間結束後投票券可當白色石楠3使用。",,
